,comment
9178,"Pessoal, produto vem lacrado, w10 reconhece sem complicação, pc virou um foguete em conjunto com ssd. Pode comprar sem medo."
9179,"Troquei a minha de 4gb por esta em meu lenovo 310, e agora possuo 12gb. Já percebi melhorias no desempenho, e olha que ainda falta colocar um ssd (que inclusive está chegando)."
9180,"Ótimo produto, alta qualidade e 100% correspondente com a descrição."
9181,"Gostei muito do produto, totalmente compatível com meu lenovo ideap 330, comprei com a mesma frequência de 2133 mhz e msm cl 15."
9182,Tá em testes por enquanto não deu problemas nem um.
9183,Componentes originais e encaixe preciso no slot. Passou em todos os quesitos no teste de performance do windows10. Velocidade compatível com o que eu esperava para a minha placa mãe.
9184,"Adorei o produto. Posso abrir muito mais coisas e o computador não trava, foi uma compra muito agradável, além de ter chegado em 3 dias!."
9185,"Aumentou bastante o desempenhi do meu pc, um dell inspiron 15 3567!."
9186,"Memória compatível com meu dell, confesso que estava com receio de não dar certo, mas resolveu o meu problema. Super indico."
9187,"Produto muito bom, funciona direitinho."
9188,Superou a minha expectativa.
9189,Instalei e estou utilizando há mais de um ano.
9190,"Produto conforme anunciado, ótimo."
9191,Exelente reconheçena hora.
9192,"Funcionou perfeitamente no notebook samsung expert x51, reconheceu o dual-channel."
9193,Produto top.
9194,Muito bom. Deu um upgrade em minha máquina.
9195,Veio bem embalada e tudo funcionando perfeitamente. Ótimo custo benefício. Recomendo.
9196,Boa memória.
9197,"Muito bom o produto, instalado e funcionando corretamente."
9198,"O produto é excelente, recomendo demais! deu um fôlego maior ao meu notebook q tem um i3 e 4gb de ram."
9199,"Ótima qualidade, serviu como uma luva para o meu notebook, tudo q eu estava precisando!."
9200,"Ótima compra mas meu notebook quase voou pela janela de tão rápido, tive que prender numa corrente."
9201,Deu certo. Reconheceu automaticamente.
9202,"Legal, ate agora nao deu nenhum defeito."
9203,Tou muito feliz com a memória. Funcionou perfeitamente no meu dell inspiron 15 série 3000 i15-3583-a30p.
9204,"Show, troquei a ram e adicionei ssd, virou outro notebook."
9205,Muito bom o produto.
9206,De acordo com o que precisava. Satisfeito!.
9207,Produto instalado e funcionando perfeitamente!.
9208,Excelente produto.
9209,Atendeu a necessidade !.
9210,Ótimo produto!.
9211,Excelente qualidade.
9212,"Funcionou perfeitamente, bem embalado."
9213,"Meu notebook tinha apenas 4 de ram, agora com 12 está muito melhor. Próximo passo é adquirir um ssd."
9214,Produto excelente. Instalei fácil sem problemas e tá rodando bem.
9215,Produto muito bom recomendo.
9216,Excelente produto. Indico a todos do mercado livre.
9217,"Muito bom, ótimo investimento para upgrade de computador compatível com este tipo de memória."
9218,"Produto otimo, recomendo."
9219,Foi colocar e o notebook reconher de imediato.
9220,Excelente!.
9221,Dentro do esperando.
9222,Excelente! junto com o ssd de 480gb meu acer i3 está muito rápido e fluido.
9223,Òtimo produto. Funcionou perfeitamente no meu note. Ficou uma bala.
9224,Ótimo. Superou minhas expectativas.
9225,Produto era o que esperava. Esta funcionando perfeitamente.
9226,Muito bom.
9227,Atendeu minhas expectativas excelente produto.
9228,"Excelente produto, recomendo."
9229,"Muito bom, melhorou o desempenho do notebook."
9230,"Funcionamento perfeito, meu notebook ficou super rapido."
9231,Produto bom não tive problemas ll.
9232,Excelente. A memoria foi prontamente reconhecida pelo sistema operacional.
9233,Comprei para o acer vx5 e funcionou certinho.
9234,Excelente. Tudo como prometido.
9235,A memória está em uso sem problemas.
9236,"Até agora, muito bom! meu not era muito fraco, comprei um ssd e a memória. O processador começou a esquenta muito. Diminui o desempenho do notebook para 70% agora ficou ótimo. Ficou muito rápido e não esquenta mais."
9237,"Perfeito, atendeu minhas expectativas, meu computador ficou super rápido, otimo para upgrade."
9238,Muito bom!!! ajudou demais no desempenho do meu antigo notebook.
9239,"Muito bom, qualidade excepcional."
9240,"Funcionou plug and play, sem problemas."
9241,"Muito bom, melhorou o desempenho do meu notebook."
9242,"Produto instalado e funcionando perfeitamente em um lenovo yoga 520-14ikb, 80ym0007br, processador intel core i5-7200u."
9243,Produto muito bom funcionando perfeitamente.
9244,Produto me atendeu tranquilamente.
9245,Correspondeu as expectativas. Recomendo!.
9246,"Excelente, recomendo a todos do ml."
9247,"Meu notebook ficou melhor do q pensei!!! valeu muito a pena, sentindo um pc gamer haha."
9248,Produto muito bom gostei muito do produto.
9249,Produto em lacrado e em perfeito estado.
9250,Muito bom e seguro!! 3 gostei muito.
9251,Eu mesma instalei no meu notebook. Está funcionando perfeitamente!.
9252,É muito bom trabalhar com folga. Boa performance.
9253,"Excelente produto, funciona perfeitamente."
9254,Excelente produto recomendo a todos.
9255,"Muito bom, funcionou perfeitamente."
9256,Comprei para o notebook dell inspirion 15. Deu outra vida na máquina. Muito bom!!!.
9257,Produto de boa qualidade. Está funcionando perfeitamente.
9258,"Produto muito bom, funcionando aqui perfeitamente."
9259,Produto excelente. Rodando certinho em dual channel. Acer aspire es 1-572-3562.
9260,Produto de ótima qualidade de acordo com o esperado.
9261,"Muito bom, melhorou bastante o desempenho do meu computador."
9262,"Muito bom, melhorou demais o desempenho do meu notebook, ficou excelente."
9263,"Memória excelente! fiz um upgrade no meu notebook e agora consigo realizar todas as minhas tarefas sem que haja travamentos. Pra quem tem um asus vivobook 15 com i3 6100 e 4gb de ram como eu, super recomendo."
9264,"Atendeu ao esperado, funcionando perfeitamente."
9265,"Produto de boa qualidade, recomendo a todos do ml."
9266,"Otimo produto super recomendo, meu notebook ficou muito rápido depois desse upgrade."
9267,"Funcionou perfeitamente, conforme o esperado!."
9268,Produto que atende a proposta.
9269,"Classe a, top, perfeito no funcionamento, super recomendo."
9270,"Funcionou certinho, reconheceu de primeira. Ótima compra !!!."
9271,"Produto bom, compra tranquila. Eu recomendo."
9272,"Produto exelente, salvou meu notebook."
9273,Produto conforme anunciado e funcionou perfeitamente no notebook. Recomendo produto.
9274,Memória ram de qualidade reconheceu na hora no meu notebook ideapad 320.
9275,"Bom produto, atendendo a expectativa. Recomendo."
9276,Excelente produto! funcionou perfeitamente!.
9277,Funciona muito bem desempenho otimo do notboock apos a intalação.
9278,"Perfeito estado, bom produto, bem embaladinho."
9279,"Excelente produto , compraria novamente."
9280,Funcionando liso. Gostei muito.
9281,Encaixou perfeitamente no meu notebook. Um mês de uso e até agora tudo perfeito.
9282,Excelente produto fiquei completamente satisfeito com o resultado.
9283,"Ótima qualidade, original e bem lacrado."
9284,O notebook voou. Ficou utilizável novamente com esta memoria.
9285,"Eles entraram em contato para certificar se a memória iria atender a minha necessidade. Podem comprar, instalei com sucesso e funcionou perfeitamente."
9286,Resolveu o problema de lentidão no notebook lenovo.
9287,Excelente produto. Deixou meu notebook antes com 4gb agora tá uma bala. Parabens.
9288,Muito bom. Perfeita para o que preciso.
9289,Honestidade e profissionalismo.
9290,Produto dentro do esperado ! recomendo !.
9291,Produto de excelente qualidade. Funcionou perfeitamente !!.
9292,"Produto de muita qualidade, muito contente com a compra. Recomendo a todos!."
9293,Excelente! funcionou muito bem no meu notebook.
9294,Serviu perfeitamente no meu acer aspire vx5 reconheceu na hora.
9295,Produto funcionando perfeitamente. Recomendo.
9296,"Produto é original, funcionou perfeitamente, superou minhas expectativas."
9297,De acordo com descritivo e funcionou corretamente.
9298,Muito bom. Funcionou muito bem no meu notebook lenovo ideapad 330.
9299,Ram muito boa. Facil instalação e funcionou muito bem.
9300,Em três meses deu problema podre.
9301,"Excelente, coloquei em meu notebook samsung e30 e melhorou muito sua performance."
9302,Funcionou muito bem! só plugar.
9303,"Funcionando perfeitamente, fácil instalação."
9304,"Tenho um notebook acer vx5 i5 e fiz o upgrade de memória com essa, ficou super top recomendo d+, ela funcionou em dual chanel com a original de fábrica perfeitamente, as duas estão trabalhando na mesma frequência e cl (15/15/15/36)."
9305,Bom demais serviu no meu not lenovo b330.
9306,"Meu notebook dell inspiron 3567 tinha só 4 gb de memória, e travava muito, com essa memória melhorou 90%. Recomendo."
9307,Muito bom! sem mais! eu mesmo fiz a instalação conforme recomendado e deu tudo certo!.
9308,Funcionou perfeitamente no notebook lenovo ideapad 320-14ikb.
9309,Produto de excelente qualidade.
9310,"Excelente memória kingston, qualidade a toda prova."
9311,Ficou top! agora preciso colocar um ssd no meu notebook e ai sim vou ver a diferença.
9312,Ótimo produto. Recomendo a todos.
9313,Atendeu às expectativas. Bastou inserir no notebook (samsung essentials e34 np300e5l) que ele reconheceu o novo pente.
9314,"Excelente o produto. Foi super fácil de colocar. E deixou meu notebook bem mais estável, sem travar tanto."
9315,"Eu comprei, e esta funcionando muito bem."
9316,Produto muito confiável. Melhorou o desempenho de minha máquina.
9317,Funcionou como prometido recomendo.
9318,Excelente qualidade salvou minha vida para meus projetos futuros.
9319,"Tudo conforme o descrito, instalei e está funcionando perfeitamente."
9320,Produto veio conforme esperado! recomendo!.
9321,Produto muito bom e vedendor bem prestativo!.
9322,"Produto excelente, recomendo. Funcionou perfeitamente no meu notebook."
9323,O computador pode fazer mais coisas ao mesmo tempo.
9324,Muito bom para upgrade de memória.
9325,"Veio conforme solicitado, gostei."
9326,Atendeu a todas as expectativas que buscava.
9327,Ótimo produto. Turbinou meu laptop que agora conta com um total de 16gb.
9328,"Produto igual ao anunciado, sem nenhum problema."
9329,"Ótimo produto, recomendo a todos."
9330,"Pegou certinho e eles ainda são bastante atenciosos, mandaram contato para ajuda técnica e td. Recomendo!."
9331,"Bom produto, e funciona perfeitamente."
9332,Surpiu as expectativas no meu lenovo 330.
9333,"Ótimo produto, funcionou tudo certo. Recomendo!."
9334,O produto eh muito bom. Funciona perfeitamente.
9335,"Produto em perfeito estado, muito bom!."
9336,"Bacana. Funcionou direitinho, veio na voltagem correta."
9337,"Produto enviado completamente diferente do anunciado no título e na descrição do produto. Tive que fazer devolução gerando perda de tempo, reembolso, stress do cliente, despesas, etc."
9338,"Galera. Tem gente falando que é falsa por estar escrito hynix no chip e não kingston. A kingston utiliza vários chips, como micron, hynix, powerpoint, nanya, entre outros. Então não se preocupem em ser memória falsificada. Testei em programas como cpu-z, aida64, sandra e nem o nome nem o número de série aparece. Porém no chip físico aparece hynix e todos os números de série."
9339,"Eu já havia comprado uma unidade, e a dica que dou é se atentem na frequência, se for 2x de 8gb de frequência diferente vai rodas sempre na frequência mais baixa, exemplo 1 de 2600ghz e uma de 1333ghz vai rodar as duas em 1333ghz, e as nas duas vezes que comprei essas de 8gb eu tive que colocar elas sozinhas para a bios reconhecer e depois colocar a outra que já estava. O desempenho delas são ótimos, só faltou a opção com dicipador de calor, aí sim ficaria top."
9340,"O produto correspondeu às fotos e atende perfeitamente ao esperado. Faço apenas 1 ressalva referente à descrição incompleta apresentada do produto. Busquei por frequência 1333mhz e ele a atende e também 1600mhz, o que não impede sua instalação e uso, uma vez que o conjunto de memórias irá operar sempre na menor frequência das memórias instaladas. No meu caso, como a outra memória opera em 1333mhz, isso em nada me afetou."
9341,Não é kingston. É hy mix. Caixa deslacrada.
9342,Não funciona fica resetando a máquina toda hora.
9343,"Pra quem quer comprar digo; vai sem medo! excelente produto, tinha um da markvision de 2gb e uma tambash chinesa na placa ipmh61p1 e removi a de 2gb para substituir com a kingston 8gb. Funcionou em dual channek que é uma beleza agora com 12gb meu photoshop voa! parabens camila excelente produto!."
9344,"Funciona perfeitamente, coloquei com uma memória de 4gb no pc antigo de 2012 que tenho, deu uma leve incompatibilidade, mas alternei as posições na placa mãe e funcionou perfeitamente. Jeito que está agora:. Slot 1: 8gb e slot 2: 4gb. Talvez devido a diferença na construção dos pentes, o windows 7 aproveita 11. 85gb ao invés de 12gb, mas está rodando lisinho."
9345,"Simplesmente queimou com 1 mês e por ter passado do período de compra garantida do ml nao trocaram e fiquei com o prejuizo. Acredito ter sido azarado, porém a loja não deu nenhuma assistência. ( placa mãe asus nova e a memória foi testada com aparelhos não foi manipulada com base em achometro. )."
9346,"Funcionou perfeitamente, já que a marca kingston também é conhecida por sua qualidade e durabilidade. E é esse o motivo de eu tê-la comprado. Bastou conectar e testar, mas o resultado já era o esperado. Custa mais caro, mas é melhor do que ir no ""barato que sai caro"" e ter problemas desnecessários."
9347,"Na descrição do produto informa 1333 mhz, porém ao executar o teste de memória memtest, informa 1600 mhz, causando uma incompatibilidade com meu hardware."
9348,"Memoria 8gb single boa para fazer tarefas e operações no windows com múltiplas tarefas , recomendaria sé o preço estive-se um pouco mais baixo. Por que geralmente não é muito usado uma single channel de 8gb."
9349,Ótimo produto! funcionou perfeitamente bem e sem erros. Na realidade falta eu fazer o teste da memória para eu ter a certeza absoluta mas aparentemente é um produto que vai funcionar por bons anos e sem instabilidades. Só é uma pena que seja tão caro.
9350,Quase 1 ano usando e tá tudo bem.
9351,"Produto funcionou perfeitamente durante 5 meses após esse período quando colocada no pc o mesmo não iniciava, guardei a mesma achando que era problema no meu pc, montei outro recentemente e tive a certeza que a memória estava apresentando problemas, fiquei decepcionado com o pouco tempo de vida útil."
9352,"Produto falsificado, é a tal de kingston chinesinha."
9353,"Atende muito bem a minha necessidade. Antes o pc travava só de usar o navegador, agora eu consigo abrir e executar vários programas com essa placa de 8 gb instalada."
9354,"Excelente produto. Atendeu as minhas expectativas e necessidades, recomendo apenas que antes de comprar verifiquem a frequência da placa, pois no meu caso eu tinha três pentes de 2 gb e para poder rodar tive que remover e utilizar os pentes de 8gb que comprei."
9355,"Muito bom a memoria ram, caso alguem colocar a ram na placa mãe e nao funcionar é pq precisa limpar o contato com borracha branca, tem video no you tube q mostra como fazer e quais cuidados pq comigo eu tive q fazer o mesmo, é só dar uma passadinha de borracha a onde fica o contato a ram com a placa mãe que resolve, mais é bom seguir os passos no you tube pra nao acabar sem querer danificando o produto."
9356,"Achei que o problema estava no meu computador, mas depois de testar em vários realmente nenhum dos dois pentes estão funcionando :( me ferrei."
9357,Não veio do jeito que eu pedi pois queria uma memória ddr3 de 1333 de frequência mas veio com a frequência de 1600 tornando dificil estalacao.
9358,Produto falso.
9359,Bom.
9360,"Horrível, não vele 260 reais nunca! trava demais."
9361,Não funcionou no meu computador.
9362,Nao funcionou sozinha no slot da maquina.
9363,"Ótimo produto, atende o que é esperado. Estou usando ambas no pc, pra ligar é necessario ligar primeiro com uma, depois conecta a outra e de boa. Super recomendo."
9364,O produto que pedi foi frequencia 1333 vcs me mandaram frequência 1600 por isso estou insatisfeito com o produto que vc me mandaram na minha nota esta na frequência 1333. Quando vcs for mandar observem antes de mandar pra que outro clientes nao fiquem insatisfeito como eu.
9365,Pessimo produto de má qualidade.
9366,Produto com defeito. Nao funciona.
9367,"Produto não tem muito tempo de uso e já parou derrepente ,."
9368,Ótimo produto de boa qualidade perfeita funciona muito bem so que eu comprei a memoria errada fiz a devolução do produto mas por erro meu o produto e ótimo.
9369,Meu computador ficou um pouco mais rápido.
9370,Produto em excelente estado. Funcionando ok.
9371,Super recomendado.
9372,Bom ótimo 💯%.
9373,Pegou de primeira. Ótima qualidade.
9374,Excellent.
9375,Perfeito cehgou muito rapido.
9376,"Perfeito, custo benéfico e qualidade."
9377,Atendeu as minhas espectativas.
9378,Gostei.
9379,Tenho usado por alguns meses e até o momento tem funcionado bem. Recomendo.
9380,"Até agora, excelente."
9381,Muito bom tô satisfeito.
9382,"Top, mandou bem."
9383,Serviu na minha placa mw h61m-2h rev 2. 1.
9384,Serviu exatamente para o que eu precisava.
9385,Funcionou td ok. Recomendo.
9386,"Comprei duas, porém uma já estragou, infelizmente."
9387,Show.
9388,"Muito bom , estu satisfeio."
9389,"Funcionou perfeitamente, estava com um pouquinho de receio de comprar , mais funcionou direitinho sem erro."
9390,Produto funciona perfeitamente.
9391,"Muito bom, fiel ao anúncio."
9392,Bom produto.
9393,"Produto muito bom, instalei e funcionaram perfeitamente."
9394,Ótima qualidade satisfeito.
9395,Funcionando perfeitamente.
9396,Recomendo.
9397,Funcionou perfeitamente.
9398,Ótimo produto! recomendo!.
9399,
9400,"Funcionamento perfeito, recomendo!!."
9401,Funcionou certinho!.
9402,Bom produto.
9403,"Produto eficiente, ajudou no desempenho do pc, tudo certo, recomendo."
9404,Nunca mais esqueci nada depois que comprei este produto.
9405,"Excelente, funciona perfeitamente."
9406,"Excelente, recomendo sem duvidas."
9407,"Muito boa as memorias ram , meu pc melhorou o desempenho."
9408,Meu pc ficou outro eu recomendo.
9409,Podem comprar tranquilamente. Qualidade e preço justo.
9410,"Meu computador só reconhece 4gb, mas acredito é devido a placa ser genérica. No mais, funciona perfeitamente."
9411,Ótima.
9412,"Serviu, muito bacana pra minha placa mãe. Usava 1 pente de 8gb e agora estou com 16gb. Até o momento estar fluindo tudo bem."
9413,Funcionando perfeitamente.
9414,Show original e rapido !.
9415,"Atendeu perfeitamente á minha necessidade, ótima compra!."
9416,Top.
9417,Otimo!.
9418,A marca já diz tudo é uma das melhores memórias.
9419,Ótimo produto muito além do esperado.
9420,"Funcionou, melhorou um o desempenho do meu pc. Se precisar vou comprar mais."
9421,Atendeu às expectativas.
9422,Sem reclamações. Faz o que é prometido.
9423,"Veio certinho, marca frequência e eu tava com 8; dual channel pus ela fico 12 terei uma aí nossa fico outra coisa recomendo compra viu."
9424,Estou usando no computador e percebi a diferença. É claro que sempre com ajuda de um técnico especializado para instalar.
9425,Produto de qualidade.
9426,Atendeu as minhas expectativas.
9427,Só não vou comprar mas no. Mercado livre pq debitaram da minha conta do mercado pago 500 reas do meu cartão de crédito.
9428,Muito top funciona de maravilha.
9429,Produto veio em perfeito estado e funcionando perfeitamente.
9430,Muito bom.
9431,Conforme esperado.
9432,"Bem, quase 2 semanas de uso e nenhum defeito apresentado. Já tinha um pente de 8gb kingston e ambos são 1333mhz, até agr nenhum gargalo. Recomendo sim, ótimo custo benefício."
9433,Excelente.
9434,Muito bom.
9435,Bom.
9436,Amei! funciona muito bem e me ajudou bastante.
9437,Produto muito bom.
9438,Até o momento funcionando bem.
9439,"Muito bom, recomendo."
9440,Top.
9441,Muito bom.
9442,Memória de boa qualidade recomendo compra.
9443,Excelente.
9444,Amei as duas memórias que comprei estão funcionando perfeitamente.
9445,Excelente.
9446,"Excelente, melhorou muito o meu pc."
9447,Funcionando bem.
9448,Tudo certo.
9449,Foi uma boa aquisição. Realmente supriu as expectativas. Até o presente momento pelo menos está funcionando muito bem!.
9450,Conforme anunciado. Funcionou perfeitame.
9451,É um bom produto.
9452,Muito bom.
9453,Excelente.
9454,Produto de excelente qualidade.
9455,"Tristeza, ao acoplar a memória ram do na placa parou de dar vídeo. Tive que levar ao técnico porém 2x e ainda deu mesmo problema. Se eu soubesse que poderia acontecer isso ficaria com 4gb mesmo."
9456,Veio de acordo como esperava bem embalada em perfeitas condições. Parabens.
9457,Perfeita.
9458,Muito bom.
9459,"Produto muito bom , tudo de acordo."
9460,Ótimo produto. Recomendo a todos do mercado livre.
9461,Qualidade e praticidade na instalação.
9462,Produto de ótima qualidade.
9463,Bom produto.
9464,Perfeito. 💯 novo recomendo a todos.
9465,Sim achei muito bom obg.
9466,Comprei a mais de um ano e continua funcionando perfeitamente.
9467,Muito bom!.
9468,Muito bom o produto super recomendo.
9469,Bom produto.
9470,Ótimo produto.
9471,Produto excelente.
9472,"Tudo certo, recomendo o vendedor."
9473,Aparenta realmente ser original e está funcionando perfeitamente.
9474,Muito bom.
9475,Funcionou perfeitamente.
9476,Produto bom funcionando perfeitamente.
9477,"Produto nota 10, meu pc ta rapidao agora."
9478,"Top demais as memorias dd3, upgrade concluído!."
9479,A memoria que eu tinha era de 1. 5v e voces me deram a de 1 v sera que vai dar problema?.
9480,"Funciona perfeitamente, muito bom pelo preço."
9481,Excelente. Funcionando perfeitamente.
9482,"Excelente funcionando perfeitamente, recomendo."
9483,Até então está tudo ok.
9484,"Conforme a descrição, funciona muito bem."
9485,Excelente produto.
9486,Funcionou perfeitamente como era o esperado.
9487,"Produto falsificado, usando programas de verificação foi constatado a falsificação. Desconfiei pelo preço e confirmei, estou devolvendo!."
9488,"Ja conhecia o produto, até o momento instalado e funcionando."
9489,Muito bom.
9490,Funcionando perfeitamente em uma asus m4n68t-m com um phenom ii x6 de 3. 2ghz que meu filho usa pra jogar com os amigos e deu uma significativa melhora na máquina.
9491,Turbinou meu pc. Ficou bala.
9492,Memória ótima não tive nenhum problema produto de ótima qualidade.
9493,Perfeito recomendo.
9494,Bom.
9495,Funciona. Porém em alguns jogos ocorre travamentos leves.
9496,"Ótimo sem nenhum problema, deu vídeo de primeira e é original, vale muito a pena recomendo nota 10."
9497,"Produto em excelente estado, funcionando sem problemas, pode comprar sem medo."
9498,Satisfeito com o produto.
9499,Top.
9500,Funciona 100% e de qualidade.
9501,Funciona bem.
9502,Produto original de ótima qualidade.
9503,"Muito bom, produto novo, funcionando perfeito!!."
9504,"Bomm, gostei muito. Recomendo."
9505,Kingston e kingston todos ja sabemos.
9506,Top.
9507,Produto funciona perfeitamente recomendo a todos 🙂.
9508,Tudo nos conformes!.
9509,Produto funcionando corretamente.
9510,Bom produto excelente.
9511,"Memoria ram excelente para a placa mãe intel chipset h61, performance otima."
9512,Muito booa a memória. Funcionou perfeitamente.
9513,Muito bomm.
9514,"Muito bom, estou gostando muito de ter 16gb de ram com o outro pente que já tinha!."
9515,Foi instalada e funciona perfeitamente muito satisfeito.
9516,Otimo produto!.
9517,Otimo mais mandou frequecia errado era para ser. 1333. Mais ta bom.
9518,Veio tudo certinho. Girando a 100 p/h.
9519,Funcionou perfeitamente junto com outro pente de memoria de 4gb tb 1333.
9520,Produto de ótima qualidade recomendo!!!.
9521,Custo beneficio perfeito! recomendo!.
9522,Ótimo desempenho boa qualidade pra quem quer começar no pc.
9523,Muito bom. De ótima qualidade. Quando precisar comprarei novamente.
9524,"Produto veio certinho, sem mais, tudo perfeito."
9525,Funciona muito bem. Ótima marca. Uso sempre.
9526,"Muito bom, funcionou muito bem no meu pc."
9527,Otimo.
9528,Bom material. Foi so instalar e usar.
9529,Produto funcionando perfeitamente. Atende as expectativas.
9530,"Já faz umas 2 semanas que comprei , e realmente a memória vale cada centavo melhorou demais o desempenho do pc!! comprarei novamente ;)."
9531,Recomendo.
9532,"Produto conforme descrito, para o uso."
9533,Muito bom produto.
9534,Excelente veio corretamente toop.
9535,"Um produto muito bom msm,de alta qualidade."
9536,Demorei mais de um mês para montar o pc. Mas quando montei funcionou direitinho.
9537,Funcionou perfeitamente. Eu msm instalei e deu certo. Tinha 6g. Tirei um pente de 2g e substitui pelo novo de 8g e o pc reconheceu o total de 12g. N tive qlqr problema com a instalação ou funcionamento. Recomendo.
9538,Opa boa tarde. Na paz m. ?. Não saber o que aconteceu mas qdo colocamos a memória no micro. O mesmo começou a apitar e queimou placa mãe. Deixamos p lá. Acionamos a troca já ok.
9539,"Ótimo, recomendo esse produto."
9540,Atendeu todas minhas espectativas. Os games que tinham gargalo não travam mais e os games que já rodavam rodaram mais liso ainda. Porém produto não aparenta ser original fica aí o ponto a ser denotado.
9541,"Atende ao esperado, indico ao ml."
