,comment
6069,"Muito boa, mas a percepção desempenho não mudou muito. Porém preciso testar ainda. Mas não me arrependo."
6070,100%.
6071,"Boa qualidade, e funcionalidade."
6072,Produto atende as expectativas.
6073,"Funcionou perfeitamente! comprei para o meu acer nitro 5, que veio com 8gb de ram e agora está com 16gb."
6074,Funcionando conforme esperado.
6075,Recomendo.
6076,Muito boa preço excelente vale a pena.
6077,"Ótimo produto, melhorou bastante o desempenho do meu acer nitro possibilitando funcionar em dual channel."
6078,"Produto bom, recomendo a todos do ml."
6079,"Supriu minhas necessidades, instalei no acer nitro 5 / modelo 515-54. Compatível com esse e outros modelos da mesma marca."
6080,Excelente componente funcionou certinho.
6081,"Ficou dmais, funcionando perfeitamente, coloquei no meu nitro 5."
6082,Muito bom!super satisfeito com o produto.
6083,Produto veio certinho. Como estava na descrição.
6084,"Memoria deu certo no meu notebook da lenovo , melhorou muito ,recomendo."
6085,Ótimo produto recomendo a todos do mercadolivre.
6086,Produto funcionamento perfeitamente com meu equipamento. Recomendo.
6087,Funcionou perfeitamente no meu notebook acer nitro 5.
6088,"Ótimo produto, trabalha super bem com o nitro 5."
6089,Produto de excelente qualidade.
6090,Otimo produto. E me deixem em paz.
6091,Atende ao propósito. Funcionou muito bem.
6092,"Excelente, foi só intalar e funcionando 100%."
6093,"Produto de excelente qualidade, deixou meu nitro 5 bem melhor com o dual channel."
6094,"Muito bom o produto, gostei basante."
6095,Muito bom. Custo benefício excelente. Vale a pena.
6096,Muito bom produto estou satisfeito.
6097,"Recomendo. Funcionou bem, e essa marca estao vindo nos notebook dell."
6098,Produto de qualidade e original. Se encaixou perfeitamente no meu acer nitro 5 515-51-50u2.
6099,"Ótimo produto, voltaria a compreensão novamente."
6100,Perfeito! já instalei e funcionando a milhão. Bastante contente com a compra.
6101,"Ótimo produto, excelente qualidade."
6102,"Produto de boa marca e cumpre o descrito. No notebook nitro 5 i5 9300h 8gb, tive ganhos medios de 15 fps colocando essa outra memoria de 8gb."
6103,"Perfeito apra o que eu precisava, super recomendo !! :)."
6104,Resolveu muito bem meu problema.
6105,Otimo! funcionou perfeitamente.
6106,"Excelente, nitro 5 rayzen 7 ficou uma bala com 16gb ram."
6107,"Produto muito bom, atendeu as expectativas, funcionou direitinho."
6108,Excelente produto. Original top de linha. Podem comprar.
6109,"Comprei para meu acer nitro 5 , reconheceu na hora, muito fácil instalação."
6110,"Muito boa, funcionou certinho e veio bem embalada."
6111,"Excelente faz oque é pra fazer, podem comprar sem medo."
6112,Ideal para o modelo acer nitro 5!.
6113,"Produto muito bom, instalei no meu notebook dell."
6114,Está funcionando perfeitamente!!! meu notebook é acer aspire 3 intel i5 roda tudo sem travar. Muito bom essa satisfação eu recomendo que tu pode comprar que combina bem intel i5 que roda bem!!! gratoo.
6115,"Otima qualidade, bem embalada para transporte."
6116,Ótimo para o meu notebook acer nitro 5 2020. Deu pra fazer dual channel perfeitamente.
6117,Serviu perfeitamente no meu notebook! ok.
6118,Excelente produto de qualidade nota 10 recomendo a todos.
6119,Ótimo custo benefício. Funcionou perfeitamente para dual channel no acer nitro 5.
6120,"Quebra o galho. Encaixou certinho no meu laptop, e funciona bem."
6121,"Excelente produto, funcionou perfeitamente no meu acer nitro 5."
6122,Serviu perfeito no meu nitro 5. Mesma frequência. Trabalhando muito bem em dual channel.
6123,"Excelente produto. Instalei a memória no meu notebook (acer aspire a515 54g 53gp) e funcionou perfeitamente. Produto original adata, confirmado após a instalação."
6124,Atendeu minha necessidade. Utilizei em conjunto a memória que já veio no acer nitro 5.
6125,"Excelente, cumpre com o planejado."
6126,Funcionou perfeitamente no acer nitro 5 an515525771.
6127,Pode comprar. É de qualidade.
6128,Funcionando normalmente muito bom.
6129,Muito boa. Funcionou perfeitamente.
6130,"Ótima memoria, é o modelo exato para meu computador, deu tudo certo. Ficou outra coisa."
6131,Produto de ótima qualidade! preço bom! estou satisfeito!.
6132,"Produto em otimo estado, funcionando perfeitamente."
6133,"Ótimo, funcionando perfeitamente."
6134,"Produto funcionando!! tenho um notebook nitro 5, obrigadoo."
6135,"O produto é bom,esta funcionando perfeitamente."
6136,"Produto muito bom, segmento intermediário, memória rápida respondendo o protocolo cl14."
6137,"Ótimo produto, funciona muito bem no notebook nitro 5 2020."
6138,Excelente produto muito confiável.
6139,Muito bom o produto. Bommmmmmmmmmmmmm.
6140,"Memoria compatível, funcionou bem no notebook del inspiron 5567."
6141,"Excelente memória, perfil para trabalhar em dual chanel no meu acer nitro 5 amd 2020."
6142,Ótimo produto. Funcinou perfeitamente no meu nitro 5. A máquina ficou super rápida estou muito satisfeito.
6143,Produto atende a necessidade. Recomendo.
6144,"Excelente produto, funcionou perfeitamente no meu acer nitro!!!."
6145,"Produto muito bom, adata é a mehor em custo beneficio."
6146,"Pra quem tá com pouca memória no notebook, esses 8gb vão mudar completamente o desempenho em multi tarefas, guias, planilhas etc. Ótimo custo benefício."
6147,"Gostei do produto, totalmente compatível com meu samsung essentials e30. Foi só abrir a tampa embaixo já feita pra troca da memória e substituir pela nova. Não conhecia a marca adata mas pelo que li parece ser muito boa e está mostrando isso na prática. Meu e30 com ssd+8gb tá voando!."
6148,"Ótima memória uso no nitro 5 em dois canais ativados, fácil instalação."
6149,"Muito bom, rodou bem no meu acer 5, deu dual chanel."
6150,Meu notebook passou a funcionar mais rápido.
6151,Funcionou perfeitamente. Pra quem quer comprar pro nitro 5 e a memoria perfeita.
6152,Por enquanto funcionando com máxima potência.
6153,"Excelente produto, ajudou bastante a melhorar o desempenho de meu notebook."
6154,"Excelente, corresponde ao anunciado, recomendo."
6155,"Funciona perfeitamente, comprei para utilizar em notebook acer nitro 5."
6156,Produto em perfeito estado e funcionando perfeitamente.
6157,Tudo conforme prometido. Zero problemas. Satisfeitíssimo com a compra.
6158,Tá funcionando bem no. Meu notebook.
6159,Tudo ok produto de qualidade boa.
6160,Funcionou perfeitamente. Ok.
6161,"Muito bom, meu acer nitro 5 ficou ainda mehor."
6162,Otimo. Veio do jeito que estava no anucio.
6163,"Resolvi dar um upgrade no meu notebook acer, está memoria ram resolveu."
6164,Deu um up muito bom no meu notebook. A máquina está rodando com bem mais velocidade. Recomendo!.
6165,"Excelente produto, funciona perfeitamente do dell inspiron 15 3000."
6166,Funcionou perfeitamente tudo ok com o produto.
6167,"Otimo produto, deu certinho em meu not."
6168,"Produto de boa qualidade, com especificações idênticas a memória original de meu notebook (acer nitro 5). Funcionou tudo corretamente, dentro do esperado."
6169,"Ótimo, funciona perfeitamente."
6170,"Otimo, bom custo beneficio dentre concorrentes."
6171,Ficou excelente no meu pc! uso para programas de engenharia. Tá voando com meus 16 gb.
6172,"Excelente, funcionou perfeitamente."
6173,Funcionou perfeitamente no meu notebook acer aspire e15 e5-553g-t4tj.
6174,Funcionou perfeitamente no acer nitro 5.
6175,Excelente. Foi reconhecida no meu notebook acer nitro 5.
6176,"Não tive problemas em relação ao produto ou cobranças indevidas, mas a nota fiscal informava um valor inferior ao anunciado."
6177,Funcionou super bem o produto.
6178,Muito bom. Atende as especificações.
6179,Atende totalmente as expectativas.
6180,"Muito bom, velocidade excelente, vale a pena."
6181,Perfeito. Notebook dell ficou voando.
6182,Atende às expectativas. Memória rápida.
6183,"Bom produto e original, recomendo."
6184,Excelente veio como imaginei.
6185,Funcionou perfeitamente. Notebook dell g3 3590.
6186,"Melhor custo benefício, nenhum problema na instalação, simples e funcional. Minha máquina é a acer nitro 5."
6187,Comprei pra dar um up no notebook da minha irmã e realmente funcionou. Boa marca custo-benefício.
6188,Satisfeito com a compra. Sempre vale a pena aumentar a memória ram e trocar o hd por um ssd.
6189,"O produto não aponta todo dados em programas característicos quando instalado no notebook, como o part number. Sendo assim como confiar se é memoria original? ou é pirata? oem?."
6190,"Memória instalada e funcionando no meu lenovo ideapad 330 15ikb. O mesmo já possui uma memória de 4gb onboard e com inclusão do módulo de 8gb passou a ter 12gb os quais estão rodando em modo dual channel. A melhora de desempenho foi gritante, tato para uso geral como em games que tiveram uma estabilidade de fps incrível. Resumindo, pode comprar na paz se tiver o mesmo modelo do meu notebook."
6191,"Essa memória é falsificada danificou meu notebook acer an515-54 no qual tive um prejuízo de mais de r$1. 000,00 com a assistência técnica da acer, pois a garantia não cobria danos causados por produtos falsificados inseridos no notebook!! quero meu dinheiro de volta!!."
6192,"Muito boa, xmp faz o clock dela as vezes passar muito dos 3000mhz (já vi mais de 3500) ela realmente tem um desempenho magnífico, uma pequena dica apenas aqui, se for comprar compre 2 para fazer dual channel caso queira jogar, ganha bons fps, ou então compre duas de 8gb."
6193,"Em menos de um ano, o produto apresentou falhas. Sendo impossível seu uso."
6194,"Atendeu perfeitamente á minha necessidade, ótima compra!."
6195,Nem tem muito o que falar. Memoria top.
6196,Produto com qualidade e preço acessível.
6197,Muito bom!!!!!!!!!!!!!!!!!!!!!.
6198,Cumpre as especificações.
6199,Ate o momento funcionando normal.
6200,A memória é ótima! estou satisfeito.
6201,"Memória original, na caixa, performance boa! já tinha uma igual e comprei outra para fazer dual channel."
6202,"Ótimo , qualidade e desempenho alto."
6203,"Produto bom,."
6204,Produto veio em boas condições!.
6205,Memoria bom e de alta velocidade.
6206,"Combinou certinho com meu i5 9600k e uma z390, otima memoria."
6207,"Material robusto e evita cargas eletrostática,."
6208,"Atende o esperado. Não conheço muito do assunto, para dizer se é melhor ou pior que outro modelo."
6209,"Memória corsair é uma das melhores. Recomendo ela, estou muito satisfeito."
6210,"Ótimo produto funcionando , em perfeita qualdiade."
6211,"Excelente, cumpre o que promete."
6212,Bom produto. Custo x benefício.
6213,"Memória de alta performance, funciona muito bem em conjunto para formar 32gb. Muito bom!."
6214,"Excelente produto,muito bom,recomendo a todos."
6215,Excelente performance! recomendo muito.
6216,Excelente produto. Já tinha um pente desses aqui e recomendo demais.
6217,"Tudo ok, produto bom e funcionando corretamente."
6218,Produto exelente! funciona perfeitamente.
6219,"Produto de ótima qualidade, funcionando perfeitamente."
6220,"Excelente muito rápida, ideal na configuração q criei."
6221,Top este produto recomendo muito.
6222,Produto de excelente qualidade. Deixou as tarefas mais rápidas. Realmente dá pra notar a diferença.
6223,"Ainda não tive a oportunidade de testar o produto,mas pelas qualificações que venho avaliando sobre este produto,vejo que ele corresponde as suas devidas expectativas."
6224,"Muito bom o produto, até agora não tive problemas."
6225,"Excelente, produto de primeira!!!."
6226,"Excelente produto, deu um up no meu desktop!."
6227,"Rma muito ruim, comprei só porque estava barata."
6228,"Como dizem nas opnioes,nao é a frequencia anunciada,a memoria vem com 1600mhz e nao 1866,eu deveria duvidar pelo preço,só vou ficar pois estou realmente precisando,mais fica a dica nao recomendo!."
6229,"Infelizmente não é original, tenho enfrentado muitos problemas com essa placa de memória ram, as vezes funciona normal e outras não."
6230,"As rams são originais da kingston, contrariando o que alguns comentaram aqui. Os modelos de placa-mãe mais modernos vão passar imediatamente a funcionar na frequência das rams, ou mudando apenas uma opção nas configurações, mas outras placas mais antigas podem precisar de outros procedimentos mais complexos. Consultem o manual das suas placas. Ainda que o seu sistema não esteja a 1866mhz, é possível ver na bios que essa é a frequência nativa das rams. Estão funcionando perfeitamente em dual channel com a frequência correta e sem overclock. São boas e muito estáveis."
6231,"Comprei o produto, logo após falei que desejava receber como estava na descrição e ele fez exatamente o contrário do que eu pedi, lamentável!."
6232,Funcionou muito bem quanto instaladas.
6233,Produto super balado. Agora meu pc tá voando!!!. Muito bom. Recomendo.
6234,Não foi a de 1866mhz como eu esperava mas funciona bem mesmo assim (sem fazer oc).
6235,"Já instalei, está funcionando normal porém o produto que eu comprei foi a hx318c10f/8 e veio uma inferior hx316c10f/8. Uma memória mais barata."
6236,"Produto bom, apenas venho com a cor errada, venho vermelha ao invés de azul, mas tirando isso, tudo certo."
6237,"Veio bem lacrada, intacta. Funcionaram perfeitamente."
6238,Excelente qualidade obrigado.
6239,Excelente.
6240,Ótimo produto.
6241,Bom.
6242,Bom de mais gostei muito recomendado.
6243,Top!.
6244,"Produto veio lacrado, ddr3 rodando os 16gb porém em 1600mhz, mas mesmo assim compensou."
6245,"Produto excelente, rápido e atendeu minhas expectativas."
6246,Excelente recomendo ao ml.
6247,Top. Atendeu as expectativas.
6248,Perfeito.
6249,"Memória de 800 mhz, não comprem, é fraude."
6250,Fuiciona perfeitamente.
6251,Gostei.
6252,"Produto com finalidade específica (módulo de memória ram ddr3 para desktops), é de marca consagrada pela qualidade de seus produtos (kingston) e de uma série mais robusta (hyperx), para operação segura em condições menos comuns, como período extenso de operação, leitura/escrita constante em memória, etc. Atende plenamente às minhas necessidades e, com certeza, a todos utilizadores de computadores que precisam de circuitos de memória confiáveis, que não coloquem em risco os dados durante quaisquer operações em quaisquer condições de uso."
6253,"Funcionando perfeitamente, atendeu minhas expectativas!!."
6254,Muito bom.
6255,Muito bom agora sim o pc ta completo.
6256,Está funcionando perfeitamente.
6257,Excelente qualidade.
6258,Muito bom.
6259,"Pronto excelente, funcionou perfeito em meu pc."
6260,Ótimo.
6261,Funciona perfeitamente.
6262,Ótimo funcionado perfeitamente.
6263,Produto muito bom.
6264,Produto corresponde a descrição.
6265,Funcionando perfeitamente recomendo.
6266,Nota 10!!!.
6267,Memória muito boa e rápida.
6268,Memórias muito boas. Funcionam bem e tiveram um bom desempenho no pc.
6269,Boa tarde muito bom mesmo gostei muito obrigado.
6270,Comprei a memoria de 1866 mhz e veio a de 1600 mhz.
6271,"Memória ram excelente, recomendo a todos!!!."
6272,Excelente superou minhas expectativas ótimo produto recomendo.
6273,Produto muito bom excelente custo e beneficio.
6274,Até o momento funcionando perfeitamente.
6275,Muito bom. Tudo ok. Funcionando perfeitamente.
6276,Recomendo muito pois produto é excelente. E tem um ótimo desempenho.
6277,"Atendeu plenamente minhas necessidades, recomendo."
6278,"Perfeita, me atendeu muito bem!."
6279,"Produto lacrado, exatamente o que eu precisava."
6280,"Atendeu as expectativas, recomendo."
6281,Gostei bastante deixou meu pc melhor mais leve.
6282,Ótimo produto!! cumpre o prometido.
6283,Atende as minhas necessidades.
6284,"Pontual, compromisso com cliente."
6285,"Perfeita, bem montada, leve, rápída."
6286,"Muito bom, apesar de não ser 1866 mhz, pro meu uso não faz muita diferença."
6287,Excelente cumpre o que promete sem problemas referente ao produto.
6288,Gostei muito. Recomendo. Meu pc esta muito rapido.
6289,"Ótimo produto , creio que não seja original porém cumpre oque promete , gostei muito."
6290,Perfeito!! funcionou bem!! atendeu a expectativa!!.
6291,"Top demais, nada a reclamar do produto, bem maior fisicamente, e com dissipador de calor top."
6292,Essa memória melhorou absurdamente a velocidade do meu pc.
6293,Excelente reconendo a todos memoria muito top.
6294,"Excelente produto, com alta tecnologia eu recomendo."
6295,"Top, ajudou no que eu precisava!."
6296,Funcionou perfeitamente. Otimo produto.
6297,O produto é novo e de ótima qualidade e oferece ótimo desempenho.
6298,Produto excelente acabamento muito bonito.
6299,Muito satisfeito com o produto.
6300,"Produto excelente. Sobretudo aos pares identicos, minha compra foi para upgrade em um pc que já tinha um pente, ativando assim o segundo canal, o que incrementa a performace. O produto é bom, e aos pares fica excelente."
6301,Incrível produto comprei 2 meu pc não trava mais ótima memória recomendo.
6302,"Nada de errado otimo bom, ok!!."
6303,Produto excelente eu indico muito. Bom.
6304,Produto original com qualidade excelente.
6305,Gostei bastante supriu minhas expectativas.
6306,Funcionando perfeitamente. Produto recomendado.
6307,Produto de excelente qualidade e desempenho.
6308,"Excelente produto,funcionando muito bem."
6309,Até o momento funcionando muito bem.
6310,Muito bom gostei de mas recomendo.
6311,"Ótima qualidade , recomendo muito essa marca , é uma das melhores."
6312,"Funcionou melhor do que o esperado, esta perfeito."
6313,"Excelente acabamento, qualidade e eficiência. Cumpre o que promete!."
6314,Está funcionando perfeitamente.
6315,Ótimo custo benefício. Minha vms estão voando!.
6316,"Boa performance, conforme especificações."
6317,Ótima memória ram pra quem quer um bom custo benefício e qualidade.
6318,"Muito bom, lacrado e funcionando normalmente. Recomendo a todos."
6319,Ótimo produto e recomendo atendeu as minhas espectativas e manuseio.
6320,Funciona normalmente numa pc gamer.
6321,Ótimo estou muito satisfeito com o produto recomendo.
6322,1600mhz apenas.
6323,Melhorou muito o meu pc!. Saí de 2g de ram pra 8gb de ram.
6324,"Depois de colocar essa memória ram de 8gb, somando com os 4gb que já tinha, e totalizando 12gb de memória, meu notebook parece ser outro!. Tudo funciona muito rápido e sem nenhum gargalo. Antes sofria pra abrir alguns programas, como o photoshop, word, excel, powerpoint, sem falar no chrome que sugava a vida do notebook rs. Nada a reclamar, somente elogios."
6325,Excelente!! memorias usadas no nitro 5 caso alguém tenha interesse na compra.
6326,Funcionou certinho com o meu lenovo ideapad 320 - 80yh00008br!.
6327,Perfeita.
6328,Excelente.
6329,Exc elente recomendo.
6330,Bom.
6331,Eu utilizava memória de 4 gb e comprei esta de 8 gb. Fez muita diferença no desempenho do notebook. Está rápido para abrir páginas na internet e aplicativos como pacote office.
6332,Produto excelente. Podem comprar sem medo!.
6333,"Ótimo, eu mesma instalei ele no meu notebook, muito fácil e rápido, e o note ficou perfeito, até atualizei para o windows 11!."
6334,Muito bom!!!.
6335,"Excelente produto apesar que veio com a frequência diferente do que foi comprado, por sorte o equipamento é compatível tudo funcionando no momento sem erros."
6336,Vou dar nota 10. Produto indispensável nos dias atuais. A latência do meu notebook agradece!.
6337,"Muito boa. Qualidade, velocidade. Ja comprei 2 vezes."
6338,Super rápidas top demais já usei anteriormente e recomendo.
6339,"Funcionando 100%, foi apenas instalar que o notebook ja reconheceu sozinho."
6340,"Segundo o meu filho, que vai fazer uso do respectivo item, ele conferiu e disse ser um produto verdadeiro. Funcionando aqui sem problema, pro trabalho de faculdade dele! eu recomendo!."
6341,"Perfeito, compatível perfeitamente com o notebook ideapad 330."
6342,"Produto de qualidade , melhorou muito o desempenho do notebook."
6343,"Top muito bom o produto, ate entao ta funcionando tudo bem."
6344,Memória bem embalda! produto original e funcionando normalmente!.
6345,"Excelente memória tenho um acer nitro 5 agora 16g de ram ddr4 , o notebook ficou muito rápido."
6346,Ótimo produto ficou super rápido.
6347,Marca tradicional. Produto excelente.
6348,Exclente produto. Funcionou de forma imediata sem problemas.
6349,Produto de excelente qualidade. Desempenho incrivelmente satisfatório. Recomendo a compra!.
6350,"Excelente produto, novo e original e funcionando tudo perfeitamente. Recomento a todos e super confiavel."
6351,"Excelente produto, funcionou perfeitamente no lenovo s145."
6352,Muito bom funcionou perfeitamente.
6353,Excelente produto. Como esperado.
6354,"Tenho um dell 5566, com memória ddr4 2400, comprei para aumentar e deu certinho, inclusive em dual channel."
6355,"Ótimo produto, atendeu as expectativas;."
6356,"Atende a expectativa, simples e eficiente."
6357,"Produto muito bom, vale muito a pena. Faz aproximadamente 3 meses que instalei em meu notebook e está surpreendendo bastante."
6358,Produto de excelente qualidade!. Recomendo!.
6359,Excelente. Agora acabou o problema de falta de memória e a velocidade aumentou. Muito satisfeito.
6360,"Produto de ótima qualidade, até o momento não há o que reclamar."
6361,"Top demais, produto de qualidade."
6362,Muito bom este produto. Pode colocar sem medo. Se tiver um ssd da mesma marca ai é que o pc fica bom mesmo.
6363,"Excelente, corsair é corsair; memoria bom de qualidade."
6364,Excelente! o computador ficou ótimo.
6365,"Excelente produto ultrapassou minhas expectativas,parabéns deus abençoe grandemente."
6366,Boa qualidade de memória. Compatível com muitas placas.
6367,Tudo certo! instalei no meu laptop acer nitro e sem problemas.
6368,Ótimo produto atendeu minhas expectativas!.
6369,Instalado em um lenovo ideapad 330 e funcionou perfeitamente.
6370,"Atende bem, funciona corretamente, nada a reclamar."
6371,"Memoria top, está funcionando 100%."
6372,Funcionando perfeitamente! recomendo!.
6373,Perfeito a bios da dell fez os testes e concluiu tudo com sucesso. Perfeito!.
6374,"Novo, e funcional. É o que importa."
6375,"Excelente recomendo muito, inspiron 15 ( i15-7567-a10p)."
6376,Notebook ficou voando!!! top demais!.
6377,Pessimo não compativel com meu computador dell.
6378,"Memória original e de qualidade. Instalado com sucesso num ideapad s145-15api com ryzen 5, em substituição a um dos módulo de 4gb (tinha 8gb, agora tem 20gb). De primeira não ligou o vídeo e me deu um susto, mas tirei, dei uma limpada na poeira dos contatos e aí funcionou perfeitamente :). Agora o chrome já consegue abrir mais de 5 abas com sucesso rs. O aumento de memória não vai fazer os jogos melhorarem (muito pouco, na verdade), mas pra trabalho com vários programas, abas abertas, editores de imagem e vídeo, ajudou muito. Recomendo pra dar uma sobrevida ao seu notebook."
6379,"Excedente, funcionou no meu nitro 5, agora com 32 de ram."
6380,Top. Funcionando perfeitamente num lenovo ideapad 3 (amd ryzen 5 5500u).
6381,"Aumentou o desempenho, valeu muito bom!."
6382,Excelente!!.
6383,Funcionando 100% em meu a515-51 aspire 5.
6384,Tudo certo comprei 2x pentes para fazer dual acer nitro.
6385,"Produto excelente, fácil instalação. Testei as memórias por 7 horas e passaram sem problemas. Recomendo."
6386,Funcionou perfeitamente e atendeu as minhas expectativas.
6387,O produto é excelente.
6388,Recomendo!.
6389,Perfeito.
6390,"Parece ser bom, infelizmente a minha veio com defeito."
6391,Meu notebook só faltou voar.
6392,Bom dia.
6393,E que dizer? funcionou ! rs.
6394,"Tudo certo até o momento. Não sei dizer na questão de desempenho se é igual ou deixa a desejar em relação a outras, porque não tenho uma base para comparar. Mas parece estar tudo certo, memória cumprindo a sua finalidade."
6395,"A descrição do produto não é tão clara, existe uma particularidade da memória que fez não funcionar no meu dell g15, tive que devolver o produto."
6396,Funcionou perfeitamente numa acer nitro 5.
6397,Tive problemas com o produto.
6398,Kingston é kingston. Não tem erro.
6399,Show de bola.
6400,Produto me atendeu mt bem.
6401,Funcionou perfeitamente! top demais.
6402,"Infelizmente a dell bloqueou essa e outras marcas de memoria no notebook dell g15 5511, tirando isso o produto é excelente."
6403,Funciona muito bem!.
6404,Produto bom.
6405,"Muito boa, alimento significante na performance do meu notebook."
6406,Recomendo a todos!. Memória ram excelente 😃.
6407,Já instalei. Funcionando muito bem.
6408,Funcionou perfeitamente em umacer nitro 5.
6409,Deu conta do recado. Muito rápida.
6410,"Produto de muita qualidade, melhorou muito a performance do meu notebook."
6411,No acer aspire 5 core i3 deu super ficou bem rápido.
6412,"Comprei p o notebook aspire vero, funcionou perfeitamente!."
6413,"Muito boa, custo beneficio excelente ;)."
6414,Funcionou perfeitamente até agora.
6415,Tudo certo. Produto conforme anunciado.
6416,"De acordo , sem nenhum problema, muito bom."
6417,Produto funcionou perfeitamente.
6418,Enviado rápido e produto de qualidade.
6419,Top.
6420,Produto original e funcionando perfeitamente.
6421,"Pluguei na placa mãe e já reconheceu logo de cara em 3200mhz, nem precisei fazer nada. Tinha uma corsair antes q precisava ficar forçando direto a velocidade correta."
6422,Muito bom.
6423,"A memória funciona. Não veio a nota fiscal. Anunciado como nova, mas é usada."
6424,Bom produto!.
6425,Comprei uma memória smart e veio uma chinesa sem marca ….
